<?xml version="1.0" encoding="UTF-8"?>
<meta xmlns="https://bookml.org/ns/1.0"
      xmlns:xsi="http://www.w3.org/2001/XMLSchema-instance"
      xsi:schemaLocation="https://bookml.org/ns/1.0 ../schema/bookml-meta.xsd"
      bookml-version="1.0"
      chapter-id="ch04"
      book-id="carrier-to-yesterday"
      draft="1">

  <para-meta pid="CH04-P0010">
    <status>draft</status>
    <pov>third-limited</pov>
    <location>Zoë's dimly lit apartment, Madrid</location>
    <timepoint>Chapter 4, Beat 1</timepoint>
    <characters>
      <character ref="zoe-kwan" role="present"/>
      <character ref="mateo-salas" role="present"/>
    </characters>
    <tags>
      <tag>establishing</tag>
      <tag>foreshadowing</tag>
    </tags>
    <tone>neutral</tone>
    <word-count>114</word-count>
    <created>2026-03-04T00:25:01+01:00</created>
    <modified>2026-03-04T00:25:01+01:00</modified>
  </para-meta>

  <para-meta pid="CH04-P0020">
    <status>draft</status>
    <pov>third-limited</pov>
    <location>Mateo's cramped, dimly lit office in the Robledo police station</location>
    <timepoint>Chapter 4, Beat 2</timepoint>
    <characters>
      <character ref="zoe-kwan" role="present"/>
      <character ref="mateo-salas" role="present"/>
    </characters>
    <tags>
      <tag>foreshadowing</tag>
    </tags>
    <tone>comic</tone>
    <word-count>119</word-count>
    <created>2026-03-04T00:25:01+01:00</created>
    <modified>2026-03-04T00:25:01+01:00</modified>
  </para-meta>

  <para-meta pid="CH04-P0030">
    <status>draft</status>
    <pov>third-limited</pov>
    <location>Zoë's cramped, dimly lit apartment in Robledo</location>
    <timepoint>Chapter 4, Beat 3</timepoint>
    <characters>
      <character ref="zoe-kwan" role="present"/>
    </characters>
    <tags>
      <tag>foreshadowing</tag>
    </tags>
    <tone>neutral</tone>
    <word-count>123</word-count>
    <created>2026-03-04T00:25:01+01:00</created>
    <modified>2026-03-04T00:25:01+01:00</modified>
  </para-meta>

  <para-meta pid="CH04-P0040">
    <status>draft</status>
    <pov>third-limited</pov>
    <location>Mateo's cramped, dimly lit van</location>
    <timepoint>Chapter 4, Beat 4</timepoint>
    <characters>
      <character ref="zoe-kwan" role="present"/>
      <character ref="mateo-salas" role="present"/>
    </characters>
    <tags>
      <tag>foreshadowing</tag>
    </tags>
    <tone>neutral</tone>
    <word-count>134</word-count>
    <created>2026-03-04T00:25:01+01:00</created>
    <modified>2026-03-04T00:25:01+01:00</modified>
  </para-meta>

  <para-meta pid="CH04-P0050">
    <status>draft</status>
    <pov>third-limited</pov>
    <location>Mateo's dimly lit apartment, Madrid</location>
    <timepoint>Chapter 4, Beat 5</timepoint>
    <characters>
      <character ref="zoe-kwan" role="present"/>
      <character ref="mateo-salas" role="present"/>
    </characters>
    <tags>
      <tag>foreshadowing</tag>
    </tags>
    <tone>sinister</tone>
    <word-count>105</word-count>
    <created>2026-03-04T00:25:01+01:00</created>
    <modified>2026-03-04T00:25:01+01:00</modified>
  </para-meta>

  <para-meta pid="CH04-P0060">
    <status>draft</status>
    <pov>third-limited</pov>
    <location>Mateo's cramped, dimly lit office</location>
    <timepoint>Chapter 4, Beat 6</timepoint>
    <characters>
      <character ref="zoe-kwan" role="present"/>
      <character ref="mateo-salas" role="present"/>
    </characters>
    <tags>
      <tag>foreshadowing</tag>
    </tags>
    <tone>neutral</tone>
    <word-count>116</word-count>
    <created>2026-03-04T00:25:01+01:00</created>
    <modified>2026-03-04T00:25:01+01:00</modified>
  </para-meta>

  <para-meta pid="CH04-P0070">
    <status>draft</status>
    <pov>third-limited</pov>
    <location>Mateo's cramped, dimly lit office</location>
    <timepoint>Chapter 4, Beat 7</timepoint>
    <characters>
      <character ref="zoe-kwan" role="present"/>
      <character ref="mateo-salas" role="present"/>
    </characters>
    <tags>
      <tag>foreshadowing</tag>
    </tags>
    <tone>neutral</tone>
    <word-count>89</word-count>
    <created>2026-03-04T00:25:01+01:00</created>
    <modified>2026-03-04T00:25:01+01:00</modified>
  </para-meta>

  <para-meta pid="CH04-P0080">
    <status>draft</status>
    <pov>third-limited</pov>
    <location>Mateo's cramped, dimly lit office</location>
    <timepoint>Chapter 4, Beat 8</timepoint>
    <characters>
      <character ref="zoe-kwan" role="present"/>
      <character ref="mateo-salas" role="present"/>
    </characters>
    <tags>
      <tag>foreshadowing</tag>
    </tags>
    <tone>neutral</tone>
    <word-count>111</word-count>
    <created>2026-03-04T00:25:01+01:00</created>
    <modified>2026-03-04T00:25:01+01:00</modified>
  </para-meta>

  <para-meta pid="CH04-P0090">
    <status>draft</status>
    <pov>third-limited</pov>
    <location>Mateo's dimly lit apartment, Madrid</location>
    <timepoint>Chapter 4, Beat 9</timepoint>
    <characters>
      <character ref="zoe-kwan" role="present"/>
      <character ref="mateo-salas" role="present"/>
    </characters>
    <tags>
      <tag>foreshadowing</tag>
    </tags>
    <tone>neutral</tone>
    <word-count>90</word-count>
    <created>2026-03-04T00:25:01+01:00</created>
    <modified>2026-03-04T00:25:01+01:00</modified>
  </para-meta>

  <para-meta pid="CH04-P0100">
    <status>draft</status>
    <pov>third-limited</pov>
    <location>Mateo's dimly lit apartment, Robledo</location>
    <timepoint>Chapter 4, Beat 10</timepoint>
    <characters>
      <character ref="zoe-kwan" role="present"/>
      <character ref="mateo-salas" role="present"/>
    </characters>
    <tags>
      <tag>foreshadowing</tag>
    </tags>
    <tone>neutral</tone>
    <word-count>103</word-count>
    <created>2026-03-04T00:25:01+01:00</created>
    <modified>2026-03-04T00:25:01+01:00</modified>
  </para-meta>

  <para-meta pid="CH04-P0110">
    <status>draft</status>
    <pov>third-limited</pov>
    <location>Mateo's dimly lit, cluttered office</location>
    <timepoint>Chapter 4, Beat 11</timepoint>
    <characters>
      <character ref="zoe-kwan" role="present"/>
      <character ref="mateo-salas" role="present"/>
    </characters>
    <tags>
      <tag>escalation</tag>
      <tag>foreshadowing</tag>
    </tags>
    <tone>neutral</tone>
    <word-count>119</word-count>
    <created>2026-03-04T00:25:01+01:00</created>
    <modified>2026-03-04T00:25:01+01:00</modified>
  </para-meta>

  <para-meta pid="CH04-P0120">
    <status>draft</status>
    <pov>third-limited</pov>
    <location>Mateo's cramped, dimly lit office in the Robledo police station</location>
    <timepoint>Chapter 4, Beat 12</timepoint>
    <characters>
      <character ref="zoe-kwan" role="present"/>
      <character ref="mateo-salas" role="present"/>
    </characters>
    <tags>
      <tag>escalation</tag>
      <tag>foreshadowing</tag>
    </tags>
    <tone>comic</tone>
    <word-count>120</word-count>
    <created>2026-03-04T00:25:01+01:00</created>
    <modified>2026-03-04T00:25:01+01:00</modified>
  </para-meta>

  <para-meta pid="CH04-P0130">
    <status>draft</status>
    <pov>third-limited</pov>
    <location>Mateo's dimly lit apartment, Madrid</location>
    <timepoint>Chapter 4, Beat 13</timepoint>
    <characters>
      <character ref="zoe-kwan" role="present"/>
      <character ref="mateo-salas" role="present"/>
    </characters>
    <tags>
      <tag>escalation</tag>
      <tag>foreshadowing</tag>
    </tags>
    <tone>neutral</tone>
    <word-count>123</word-count>
    <created>2026-03-04T00:25:01+01:00</created>
    <modified>2026-03-04T00:25:01+01:00</modified>
  </para-meta>

  <para-meta pid="CH04-P0140">
    <status>draft</status>
    <pov>third-limited</pov>
    <location>Mateo's dimly lit apartment, Robledo</location>
    <timepoint>Chapter 4, Beat 14</timepoint>
    <characters>
      <character ref="zoe-kwan" role="present"/>
      <character ref="mateo-salas" role="present"/>
    </characters>
    <tags>
      <tag>escalation</tag>
      <tag>foreshadowing</tag>
    </tags>
    <tone>neutral</tone>
    <word-count>106</word-count>
    <created>2026-03-04T00:25:01+01:00</created>
    <modified>2026-03-04T00:25:01+01:00</modified>
  </para-meta>

  <para-meta pid="CH04-P0150">
    <status>draft</status>
    <pov>third-limited</pov>
    <location>Zoë's dimly lit apartment, Robledo</location>
    <timepoint>Chapter 4, Beat 15</timepoint>
    <characters>
      <character ref="zoe-kwan" role="present"/>
      <character ref="mateo-salas" role="present"/>
    </characters>
    <tags>
      <tag>escalation</tag>
      <tag>foreshadowing</tag>
    </tags>
    <tone>neutral</tone>
    <word-count>115</word-count>
    <created>2026-03-04T00:25:01+01:00</created>
    <modified>2026-03-04T00:25:01+01:00</modified>
  </para-meta>

</meta>
