<?xml version="1.0" encoding="UTF-8"?>
<meta xmlns="https://bookml.org/ns/1.0"
      xmlns:xsi="http://www.w3.org/2001/XMLSchema-instance"
      xsi:schemaLocation="https://bookml.org/ns/1.0 ../schema/bookml-meta.xsd"
      bookml-version="1.0"
      chapter-id="ch14"
      book-id="carrier-to-yesterday"
      draft="1">

  <para-meta pid="CH14-P0010">
    <status>draft</status>
    <pov>third-limited</pov>
    <location>Zoë's dimly lit apartment, Madrid</location>
    <timepoint>Chapter 14, Beat 1</timepoint>
    <characters>
      <character ref="zoe-kwan" role="present"/>
    </characters>
    <tags>
      <tag>establishing</tag>
      <tag>foreshadowing</tag>
    </tags>
    <tone>neutral</tone>
    <word-count>139</word-count>
    <created>2026-03-06T17:40:31+01:00</created>
    <modified>2026-03-06T17:40:31+01:00</modified>
  </para-meta>

  <para-meta pid="CH14-P0020">
    <status>draft</status>
    <pov>third-limited</pov>
    <location>Zoë's dimly lit apartment, Mateo pacing in the background</location>
    <timepoint>Chapter 14, Beat 2</timepoint>
    <characters>
      <character ref="zoe-kwan" role="present"/>
      <character ref="mateo-salas" role="present"/>
    </characters>
    <tags>
      <tag>foreshadowing</tag>
    </tags>
    <tone>neutral</tone>
    <word-count>150</word-count>
    <created>2026-03-06T17:40:31+01:00</created>
    <modified>2026-03-06T17:40:31+01:00</modified>
  </para-meta>

  <para-meta pid="CH14-P0030">
    <status>draft</status>
    <pov>third-limited</pov>
    <location>Zoë's cluttered apartment, Madrid</location>
    <timepoint>Chapter 14, Beat 3</timepoint>
    <characters>
      <character ref="zoe-kwan" role="present"/>
      <character ref="mateo-salas" role="present"/>
    </characters>
    <tags>
      <tag>foreshadowing</tag>
    </tags>
    <tone>neutral</tone>
    <word-count>111</word-count>
    <created>2026-03-06T17:40:31+01:00</created>
    <modified>2026-03-06T17:40:31+01:00</modified>
  </para-meta>

  <para-meta pid="CH14-P0040">
    <status>draft</status>
    <pov>third-limited</pov>
    <location>Zoë's dimly lit apartment, Mateo's laptop open on the coffee table</location>
    <timepoint>Chapter 14, Beat 4</timepoint>
    <characters>
      <character ref="zoe-kwan" role="present"/>
      <character ref="mateo-salas" role="present"/>
    </characters>
    <tags>
      <tag>foreshadowing</tag>
    </tags>
    <tone>neutral</tone>
    <word-count>94</word-count>
    <created>2026-03-06T17:40:31+01:00</created>
    <modified>2026-03-06T17:40:31+01:00</modified>
  </para-meta>

  <para-meta pid="CH14-P0050">
    <status>draft</status>
    <pov>third-limited</pov>
    <location>Zoë's dimly lit apartment, Mateo's makeshift lab in the background</location>
    <timepoint>Chapter 14, Beat 5</timepoint>
    <characters>
      <character ref="zoe-kwan" role="present"/>
      <character ref="mateo-salas" role="present"/>
    </characters>
    <tags>
      <tag>foreshadowing</tag>
    </tags>
    <tone>neutral</tone>
    <word-count>111</word-count>
    <created>2026-03-06T17:40:31+01:00</created>
    <modified>2026-03-06T17:40:31+01:00</modified>
  </para-meta>

  <para-meta pid="CH14-P0060">
    <status>draft</status>
    <pov>third-limited</pov>
    <location>Zoë's dimly lit apartment, Mateo's laptop open on the coffee table</location>
    <timepoint>Chapter 14, Beat 6</timepoint>
    <characters>
      <character ref="zoe-kwan" role="present"/>
      <character ref="mateo-salas" role="present"/>
    </characters>
    <tags>
      <tag>foreshadowing</tag>
    </tags>
    <tone>neutral</tone>
    <word-count>97</word-count>
    <created>2026-03-06T17:40:31+01:00</created>
    <modified>2026-03-06T17:40:31+01:00</modified>
  </para-meta>

  <para-meta pid="CH14-P0070">
    <status>draft</status>
    <pov>third-limited</pov>
    <location>Zoë's dimly lit apartment, Mateo pacing in the background</location>
    <timepoint>Chapter 14, Beat 7</timepoint>
    <characters>
      <character ref="zoe-kwan" role="present"/>
      <character ref="mateo-salas" role="present"/>
    </characters>
    <tags>
      <tag>foreshadowing</tag>
    </tags>
    <tone>neutral</tone>
    <word-count>123</word-count>
    <created>2026-03-06T17:40:31+01:00</created>
    <modified>2026-03-06T17:40:31+01:00</modified>
  </para-meta>

  <para-meta pid="CH14-P0080">
    <status>draft</status>
    <pov>third-limited</pov>
    <location>Zoë's dimly lit apartment, Mateo's laptop open on the coffee table</location>
    <timepoint>Chapter 14, Beat 8</timepoint>
    <characters>
      <character ref="zoe-kwan" role="present"/>
      <character ref="mateo-salas" role="present"/>
    </characters>
    <tags>
      <tag>foreshadowing</tag>
    </tags>
    <tone>neutral</tone>
    <word-count>104</word-count>
    <created>2026-03-06T17:40:31+01:00</created>
    <modified>2026-03-06T17:40:31+01:00</modified>
  </para-meta>

  <para-meta pid="CH14-P0090">
    <status>draft</status>
    <pov>third-limited</pov>
    <location>Zoë's dimly lit apartment, Mateo's laptop open on the coffee table</location>
    <timepoint>Chapter 14, Beat 9</timepoint>
    <characters>
      <character ref="zoe-kwan" role="present"/>
      <character ref="mateo-salas" role="present"/>
    </characters>
    <tags>
      <tag>foreshadowing</tag>
    </tags>
    <tone>neutral</tone>
    <word-count>94</word-count>
    <created>2026-03-06T17:40:31+01:00</created>
    <modified>2026-03-06T17:40:31+01:00</modified>
  </para-meta>

  <para-meta pid="CH14-P0100">
    <status>draft</status>
    <pov>third-limited</pov>
    <location>Zoë's dimly lit apartment, Mateo pacing outside her door</location>
    <timepoint>Chapter 14, Beat 10</timepoint>
    <characters>
      <character ref="zoe-kwan" role="present"/>
      <character ref="mateo-salas" role="present"/>
    </characters>
    <tags>
      <tag>escalation</tag>
      <tag>foreshadowing</tag>
    </tags>
    <tone>neutral</tone>
    <word-count>108</word-count>
    <created>2026-03-06T17:40:31+01:00</created>
    <modified>2026-03-06T17:40:31+01:00</modified>
  </para-meta>

  <para-meta pid="CH14-P0110">
    <status>draft</status>
    <pov>third-limited</pov>
    <location>Zoë's dimly lit hotel room, Madrid</location>
    <timepoint>Chapter 14, Beat 11</timepoint>
    <characters>
      <character ref="zoe-kwan" role="present"/>
      <character ref="mateo-salas" role="present"/>
    </characters>
    <tags>
      <tag>escalation</tag>
      <tag>foreshadowing</tag>
    </tags>
    <tone>neutral</tone>
    <word-count>125</word-count>
    <created>2026-03-06T17:40:31+01:00</created>
    <modified>2026-03-06T17:40:31+01:00</modified>
  </para-meta>

  <para-meta pid="CH14-P0120">
    <status>draft</status>
    <pov>third-limited</pov>
    <location>Zoë's dimly lit apartment, Mateo's laptop open on the coffee table</location>
    <timepoint>Chapter 14, Beat 12</timepoint>
    <characters>
      <character ref="zoe-kwan" role="present"/>
      <character ref="mateo-salas" role="present"/>
    </characters>
    <tags>
      <tag>escalation</tag>
      <tag>foreshadowing</tag>
    </tags>
    <tone>neutral</tone>
    <word-count>109</word-count>
    <created>2026-03-06T17:40:31+01:00</created>
    <modified>2026-03-06T17:40:31+01:00</modified>
  </para-meta>

  <para-meta pid="CH14-P0130">
    <status>draft</status>
    <pov>third-limited</pov>
    <location>Abandoned warehouse on outskirts of Madrid</location>
    <timepoint>Chapter 14, Beat 13</timepoint>
    <characters>
      <character ref="zoe-kwan" role="present"/>
      <character ref="mateo-salas" role="present"/>
    </characters>
    <tags>
      <tag>escalation</tag>
      <tag>foreshadowing</tag>
    </tags>
    <tone>neutral</tone>
    <word-count>103</word-count>
    <created>2026-03-06T17:40:31+01:00</created>
    <modified>2026-03-06T17:40:31+01:00</modified>
  </para-meta>

  <para-meta pid="CH14-P0140">
    <status>draft</status>
    <pov>third-limited</pov>
    <location>Zoë's dimly lit apartment, Mateo's laptop open on the coffee table</location>
    <timepoint>Chapter 14, Beat 14</timepoint>
    <characters>
      <character ref="zoe-kwan" role="present"/>
      <character ref="mateo-salas" role="present"/>
    </characters>
    <tags>
      <tag>escalation</tag>
      <tag>foreshadowing</tag>
    </tags>
    <tone>neutral</tone>
    <word-count>140</word-count>
    <created>2026-03-06T17:40:31+01:00</created>
    <modified>2026-03-06T17:40:31+01:00</modified>
  </para-meta>

</meta>
