<?xml version="1.0" encoding="UTF-8"?>
<meta xmlns="https://bookml.org/ns/1.0"
      xmlns:xsi="http://www.w3.org/2001/XMLSchema-instance"
      xsi:schemaLocation="https://bookml.org/ns/1.0 ../schema/bookml-meta.xsd"
      bookml-version="1.0"
      chapter-id="ch13"
      book-id="carrier-to-yesterday"
      draft="1">

  <para-meta pid="CH13-P0010">
    <status>draft</status>
    <pov>third-limited</pov>
    <location>Mateo's dimly lit hotel room in Robledo</location>
    <timepoint>Chapter 13, Beat 1</timepoint>
    <characters>
      <character ref="mateo-salas" role="present"/>
    </characters>
    <tags>
      <tag>establishing</tag>
      <tag>foreshadowing</tag>
    </tags>
    <tone>neutral</tone>
    <word-count>125</word-count>
    <created>2026-03-06T13:22:04+01:00</created>
    <modified>2026-03-06T13:22:04+01:00</modified>
  </para-meta>

  <para-meta pid="CH13-P0020">
    <status>draft</status>
    <pov>third-limited</pov>
    <location>Mateo's rented flat in Robledo, Spain</location>
    <timepoint>Chapter 13, Beat 2</timepoint>
    <characters>
      <character ref="mateo-salas" role="present"/>
    </characters>
    <tags>
      <tag>foreshadowing</tag>
    </tags>
    <tone>neutral</tone>
    <word-count>137</word-count>
    <created>2026-03-06T13:22:04+01:00</created>
    <modified>2026-03-06T13:22:04+01:00</modified>
  </para-meta>

  <para-meta pid="CH13-P0030">
    <status>draft</status>
    <pov>third-limited</pov>
    <location>Mateo's car, speeding down the deserted highway to Robledo</location>
    <timepoint>Chapter 13, Beat 3</timepoint>
    <characters>
      <character ref="mateo-salas" role="present"/>
    </characters>
    <tags>
      <tag>foreshadowing</tag>
    </tags>
    <tone>neutral</tone>
    <word-count>88</word-count>
    <created>2026-03-06T13:22:04+01:00</created>
    <modified>2026-03-06T13:22:04+01:00</modified>
  </para-meta>

  <para-meta pid="CH13-P0040">
    <status>draft</status>
    <pov>third-limited</pov>
    <location>Mateo's car, approaching Robledo</location>
    <timepoint>Chapter 13, Beat 4</timepoint>
    <characters>
      <character ref="mateo-salas" role="present"/>
    </characters>
    <tags>
      <tag>foreshadowing</tag>
    </tags>
    <tone>sinister</tone>
    <word-count>120</word-count>
    <created>2026-03-06T13:22:04+01:00</created>
    <modified>2026-03-06T13:22:04+01:00</modified>
  </para-meta>

  <para-meta pid="CH13-P0050">
    <status>draft</status>
    <pov>third-limited</pov>
    <location>Mateo's car, approaching Robledo's outskirts</location>
    <timepoint>Chapter 13, Beat 5</timepoint>
    <characters>
      <character ref="mateo-salas" role="present"/>
    </characters>
    <tags>
      <tag>foreshadowing</tag>
    </tags>
    <tone>neutral</tone>
    <word-count>115</word-count>
    <created>2026-03-06T13:22:04+01:00</created>
    <modified>2026-03-06T13:22:04+01:00</modified>
  </para-meta>

  <para-meta pid="CH13-P0060">
    <status>draft</status>
    <pov>third-limited</pov>
    <location>Mateo's car, approaching Robledo</location>
    <timepoint>Chapter 13, Beat 6</timepoint>
    <characters>
      <character ref="mateo-salas" role="present"/>
    </characters>
    <tags>
      <tag>foreshadowing</tag>
    </tags>
    <tone>neutral</tone>
    <word-count>108</word-count>
    <created>2026-03-06T13:22:04+01:00</created>
    <modified>2026-03-06T13:22:04+01:00</modified>
  </para-meta>

  <para-meta pid="CH13-P0070">
    <status>draft</status>
    <pov>third-limited</pov>
    <location>Mateo's car, approaching Robledo</location>
    <timepoint>Chapter 13, Beat 7</timepoint>
    <characters>
      <character ref="mateo-salas" role="present"/>
    </characters>
    <tags>
      <tag>foreshadowing</tag>
    </tags>
    <tone>sinister</tone>
    <word-count>93</word-count>
    <created>2026-03-06T13:22:04+01:00</created>
    <modified>2026-03-06T13:22:04+01:00</modified>
  </para-meta>

  <para-meta pid="CH13-P0080">
    <status>draft</status>
    <pov>third-limited</pov>
    <location>Mateo's car, approaching Robledo</location>
    <timepoint>Chapter 13, Beat 8</timepoint>
    <characters>
      <character ref="mateo-salas" role="present"/>
    </characters>
    <tags>
      <tag>foreshadowing</tag>
    </tags>
    <tone>neutral</tone>
    <word-count>143</word-count>
    <created>2026-03-06T13:22:04+01:00</created>
    <modified>2026-03-06T13:22:04+01:00</modified>
  </para-meta>

  <para-meta pid="CH13-P0090">
    <status>draft</status>
    <pov>third-limited</pov>
    <location>Mateo's car, approaching Robledo</location>
    <timepoint>Chapter 13, Beat 9</timepoint>
    <characters>
      <character ref="mateo-salas" role="present"/>
    </characters>
    <tags>
      <tag>foreshadowing</tag>
    </tags>
    <tone>neutral</tone>
    <word-count>111</word-count>
    <created>2026-03-06T13:22:04+01:00</created>
    <modified>2026-03-06T13:22:04+01:00</modified>
  </para-meta>

  <para-meta pid="CH13-P0100">
    <status>draft</status>
    <pov>third-limited</pov>
    <location>Mateo's car, approaching Robledo's outskirts</location>
    <timepoint>Chapter 13, Beat 10</timepoint>
    <characters>
      <character ref="mateo-salas" role="present"/>
    </characters>
    <tags>
      <tag>escalation</tag>
      <tag>foreshadowing</tag>
    </tags>
    <tone>neutral</tone>
    <word-count>91</word-count>
    <created>2026-03-06T13:22:04+01:00</created>
    <modified>2026-03-06T13:22:04+01:00</modified>
  </para-meta>

  <para-meta pid="CH13-P0110">
    <status>draft</status>
    <pov>third-limited</pov>
    <location>Mateo's car, approaching Robledo</location>
    <timepoint>Chapter 13, Beat 11</timepoint>
    <characters>
      <character ref="mateo-salas" role="present"/>
    </characters>
    <tags>
      <tag>escalation</tag>
      <tag>foreshadowing</tag>
    </tags>
    <tone>neutral</tone>
    <word-count>127</word-count>
    <created>2026-03-06T13:22:04+01:00</created>
    <modified>2026-03-06T13:22:04+01:00</modified>
  </para-meta>

  <para-meta pid="CH13-P0120">
    <status>draft</status>
    <pov>third-limited</pov>
    <location>Mateo's car, approaching Robledo</location>
    <timepoint>Chapter 13, Beat 12</timepoint>
    <characters>
      <character ref="mateo-salas" role="present"/>
    </characters>
    <tags>
      <tag>escalation</tag>
      <tag>foreshadowing</tag>
    </tags>
    <tone>sinister</tone>
    <word-count>101</word-count>
    <created>2026-03-06T13:22:04+01:00</created>
    <modified>2026-03-06T13:22:04+01:00</modified>
  </para-meta>

  <para-meta pid="CH13-P0130">
    <status>draft</status>
    <pov>third-limited</pov>
    <location>Mateo's car, approaching Robledo</location>
    <timepoint>Chapter 13, Beat 13</timepoint>
    <characters>
      <character ref="mateo-salas" role="present"/>
    </characters>
    <tags>
      <tag>escalation</tag>
      <tag>foreshadowing</tag>
    </tags>
    <tone>neutral</tone>
    <word-count>101</word-count>
    <created>2026-03-06T13:22:04+01:00</created>
    <modified>2026-03-06T13:22:04+01:00</modified>
  </para-meta>

  <para-meta pid="CH13-P0140">
    <status>draft</status>
    <pov>third-limited</pov>
    <location>Mateo's hotel room, Robledo</location>
    <timepoint>Chapter 13, Beat 14</timepoint>
    <characters>
      <character ref="mateo-salas" role="present"/>
    </characters>
    <tags>
      <tag>escalation</tag>
      <tag>foreshadowing</tag>
    </tags>
    <tone>sinister</tone>
    <word-count>134</word-count>
    <created>2026-03-06T13:22:04+01:00</created>
    <modified>2026-03-06T13:22:04+01:00</modified>
  </para-meta>

</meta>
