<?xml version="1.0" encoding="UTF-8"?>
<meta xmlns="https://bookml.org/ns/1.0"
      xmlns:xsi="http://www.w3.org/2001/XMLSchema-instance"
      xsi:schemaLocation="https://bookml.org/ns/1.0 ../schema/bookml-meta.xsd"
      bookml-version="1.0"
      chapter-id="ch03"
      book-id="carrier-to-yesterday"
      draft="1">

  <para-meta pid="CH03-P0010">
    <status>draft</status>
    <pov>third-limited</pov>
    <location>Mateo's apartment</location>
    <timepoint>Chapter 3, Beat 1</timepoint>
    <characters>
      <character ref="mateo-salas" role="present"/>
    </characters>
    <tags>
      <tag>establishing</tag>
      <tag>foreshadowing</tag>
    </tags>
    <tone>neutral</tone>
    <word-count>121</word-count>
    <created>2026-03-03T19:47:14+01:00</created>
    <modified>2026-03-03T19:47:14+01:00</modified>
  </para-meta>

  <para-meta pid="CH03-P0020">
    <status>draft</status>
    <pov>third-limited</pov>
    <location>Mateo's apartment</location>
    <timepoint>Chapter 3, Beat 2</timepoint>
    <characters>
      <character ref="mateo-salas" role="present"/>
    </characters>
    <tags>
      <tag>foreshadowing</tag>
    </tags>
    <tone>neutral</tone>
    <word-count>119</word-count>
    <created>2026-03-03T19:47:14+01:00</created>
    <modified>2026-03-03T19:47:14+01:00</modified>
  </para-meta>

  <para-meta pid="CH03-P0030">
    <status>draft</status>
    <pov>third-limited</pov>
    <location>Robledo streets</location>
    <timepoint>Chapter 3, Beat 3</timepoint>
    <characters>
      <character ref="mateo-salas" role="present"/>
    </characters>
    <tags>
      <tag>foreshadowing</tag>
    </tags>
    <tone>neutral</tone>
    <word-count>100</word-count>
    <created>2026-03-03T19:47:14+01:00</created>
    <modified>2026-03-03T19:47:14+01:00</modified>
  </para-meta>

  <para-meta pid="CH03-P0040">
    <status>draft</status>
    <pov>third-limited</pov>
    <location>Cybersecurity office</location>
    <timepoint>Chapter 3, Beat 4</timepoint>
    <characters>
      <character ref="mateo-salas" role="present"/>
    </characters>
    <tags>
      <tag>foreshadowing</tag>
    </tags>
    <tone>neutral</tone>
    <word-count>117</word-count>
    <created>2026-03-03T19:47:14+01:00</created>
    <modified>2026-03-03T19:47:14+01:00</modified>
  </para-meta>

  <para-meta pid="CH03-P0050">
    <status>draft</status>
    <pov>third-limited</pov>
    <location>Cybersecurity office</location>
    <timepoint>Chapter 3, Beat 5</timepoint>
    <characters>
      <character ref="mateo-salas" role="present"/>
    </characters>
    <tags>
      <tag>foreshadowing</tag>
    </tags>
    <tone>neutral</tone>
    <word-count>92</word-count>
    <created>2026-03-03T19:47:14+01:00</created>
    <modified>2026-03-03T19:47:14+01:00</modified>
  </para-meta>

  <para-meta pid="CH03-P0060">
    <status>draft</status>
    <pov>third-limited</pov>
    <location>Cybersecurity office</location>
    <timepoint>Chapter 3, Beat 6</timepoint>
    <characters>
      <character ref="mateo-salas" role="present"/>
    </characters>
    <tags>
      <tag>foreshadowing</tag>
    </tags>
    <tone>neutral</tone>
    <word-count>115</word-count>
    <created>2026-03-03T19:47:14+01:00</created>
    <modified>2026-03-03T19:47:14+01:00</modified>
  </para-meta>

  <para-meta pid="CH03-P0070">
    <status>draft</status>
    <pov>third-limited</pov>
    <location>Cybersecurity office</location>
    <timepoint>Chapter 3, Beat 7</timepoint>
    <characters>
      <character ref="mateo-salas" role="present"/>
    </characters>
    <tags>
      <tag>foreshadowing</tag>
    </tags>
    <tone>neutral</tone>
    <word-count>118</word-count>
    <created>2026-03-03T19:47:14+01:00</created>
    <modified>2026-03-03T19:47:14+01:00</modified>
  </para-meta>

  <para-meta pid="CH03-P0080">
    <status>draft</status>
    <pov>third-limited</pov>
    <location>Robledo streets</location>
    <timepoint>Chapter 3, Beat 8</timepoint>
    <characters>
      <character ref="mateo-salas" role="present"/>
    </characters>
    <tags>
      <tag>foreshadowing</tag>
    </tags>
    <tone>neutral</tone>
    <word-count>98</word-count>
    <created>2026-03-03T19:47:14+01:00</created>
    <modified>2026-03-03T19:47:14+01:00</modified>
  </para-meta>

  <para-meta pid="CH03-P0090">
    <status>draft</status>
    <pov>third-limited</pov>
    <location>Cybersecurity office</location>
    <timepoint>Chapter 3, Beat 9</timepoint>
    <characters>
      <character ref="mateo-salas" role="present"/>
    </characters>
    <tags>
      <tag>foreshadowing</tag>
    </tags>
    <tone>neutral</tone>
    <word-count>129</word-count>
    <created>2026-03-03T19:47:14+01:00</created>
    <modified>2026-03-03T19:47:14+01:00</modified>
  </para-meta>

  <para-meta pid="CH03-P0100">
    <status>draft</status>
    <pov>third-limited</pov>
    <location>Chief's office</location>
    <timepoint>Chapter 3, Beat 10</timepoint>
    <characters>
      <character ref="mateo-salas" role="present"/>
    </characters>
    <tags>
      <tag>foreshadowing</tag>
    </tags>
    <tone>neutral</tone>
    <word-count>140</word-count>
    <created>2026-03-03T19:47:14+01:00</created>
    <modified>2026-03-03T19:47:14+01:00</modified>
  </para-meta>

  <para-meta pid="CH03-P0110">
    <status>draft</status>
    <pov>third-limited</pov>
    <location>Cybersecurity office</location>
    <timepoint>Chapter 3, Beat 11</timepoint>
    <characters>
      <character ref="mateo-salas" role="present"/>
    </characters>
    <tags>
      <tag>foreshadowing</tag>
    </tags>
    <tone>neutral</tone>
    <word-count>95</word-count>
    <created>2026-03-03T19:47:14+01:00</created>
    <modified>2026-03-03T19:47:14+01:00</modified>
  </para-meta>

  <para-meta pid="CH03-P0120">
    <status>draft</status>
    <pov>third-limited</pov>
    <location>Robledo streets</location>
    <timepoint>Chapter 3, Beat 12</timepoint>
    <characters>
      <character ref="mateo-salas" role="present"/>
    </characters>
    <tags>
      <tag>escalation</tag>
      <tag>foreshadowing</tag>
    </tags>
    <tone>sinister</tone>
    <word-count>106</word-count>
    <created>2026-03-03T19:47:14+01:00</created>
    <modified>2026-03-03T19:47:14+01:00</modified>
  </para-meta>

  <para-meta pid="CH03-P0130">
    <status>draft</status>
    <pov>third-limited</pov>
    <location>Mateo's apartment</location>
    <timepoint>Chapter 3, Beat 13</timepoint>
    <characters>
      <character ref="mateo-salas" role="present"/>
    </characters>
    <tags>
      <tag>escalation</tag>
      <tag>foreshadowing</tag>
    </tags>
    <tone>neutral</tone>
    <word-count>127</word-count>
    <created>2026-03-03T19:47:14+01:00</created>
    <modified>2026-03-03T19:47:14+01:00</modified>
  </para-meta>

  <para-meta pid="CH03-P0140">
    <status>draft</status>
    <pov>third-limited</pov>
    <location>Mateo's apartment</location>
    <timepoint>Chapter 3, Beat 14</timepoint>
    <characters>
      <character ref="mateo-salas" role="present"/>
    </characters>
    <tags>
      <tag>escalation</tag>
      <tag>foreshadowing</tag>
    </tags>
    <tone>neutral</tone>
    <word-count>134</word-count>
    <created>2026-03-03T19:47:14+01:00</created>
    <modified>2026-03-03T19:47:14+01:00</modified>
  </para-meta>

  <para-meta pid="CH03-P0150">
    <status>draft</status>
    <pov>third-limited</pov>
    <location>Robledo streets</location>
    <timepoint>Chapter 3, Beat 15</timepoint>
    <characters>
      <character ref="mateo-salas" role="present"/>
    </characters>
    <tags>
      <tag>escalation</tag>
      <tag>foreshadowing</tag>
    </tags>
    <tone>neutral</tone>
    <word-count>101</word-count>
    <created>2026-03-03T19:47:14+01:00</created>
    <modified>2026-03-03T19:47:14+01:00</modified>
  </para-meta>

  <para-meta pid="CH03-P0160">
    <status>draft</status>
    <pov>third-limited</pov>
    <location>Cybersecurity office</location>
    <timepoint>Chapter 3, Beat 16</timepoint>
    <characters>
      <character ref="mateo-salas" role="present"/>
    </characters>
    <tags>
      <tag>escalation</tag>
      <tag>foreshadowing</tag>
    </tags>
    <tone>neutral</tone>
    <word-count>134</word-count>
    <created>2026-03-03T19:47:14+01:00</created>
    <modified>2026-03-03T19:47:14+01:00</modified>
  </para-meta>

</meta>
